herb_id,overview,how_to_use,how_to_grow,note
1,"**エルダー（和名：西洋接骨木/セイヨウニワトコ）** は、スイカズラ科の落葉低木~小高木(2-10m) です。  
薬効成分が多く含まれるため、食用だけではなく民間薬としても利用されてきました。日本国内にもエルダー（ニワトコ）が自生しており、生薬・漢方薬としても扱われています。

一般的な **ハーブとして知られているのはヨーロッパ原産のセイヨウニワトコ** で、日本のニワトコとは別の種類です。  
セイヨウニワトコはマスカットのような香りの花（エルダーフラワー）や、アントシアニンを多く含む実（エルダーベリー）を飲み物やお菓子に利用する、ヨーロッパでは身近なハーブです。  
※ 英国の有名な魔法使い物語にも「ニワトコの魔法の杖」の話が出てきますね。","#### 花（エルダーフラワー）
6月頃に花が咲いたら、花房ごとはさみで切り取り収穫します。  
乾燥させてハーブティーにしたり、大量に収穫出来た場合はエルダーフラワーコーディアル（シロップ）を作り、飲み物やお菓子作りに利用します。  
コーディアルは冷蔵で 2 か月程度、冷凍で半年程度保存出来ます。  
あまり一般的ではありませんが、天ぷら（フリッター）にして食べる地域もあるようです。

#### 葉（エルダーリーフ）

適宜収穫して新芽を天ぷらにしたり、葉を乾燥させてハーブティーにします。  
生の葉には少量の毒性がありますので、生食は避けましょう。

#### 実（エルダーベリー）

秋に完熟した実はジャムにします。  
未熟な生の実にも少量の毒性がありますので、生食は避けましょう。",エルダーの育て方,""
